{
  "$schema": "https://json-schema.org/draft/2020-12/schema",
  "$id": "https://raw.githubusercontent.com/gameyfin/plugin-marketplace/main/schema/plugin-manifest.schema.json",
  "title": "Gameyfin plugin marketplace manifest",
  "description": "Describes a plugin listed in the Gameyfin plugin marketplace. The file must be named <id>.json and placed in plugins/.",
  "type": "object",
  "additionalProperties": false,
  "required": [
    "id",
    "name",
    "description",
    "provider",
    "license",
    "projectUrl",
    "types",
    "maintainers",
    "releases"
  ],
  "properties": {
    "$schema": {
      "type": "string"
    },
    "id": {
      "description": "Unique plugin ID. Must be identical to 'Plugin-Id' in the MANIFEST.MF of the plugin JAR. IDs starting with 'org.gameyfin.' are reserved.",
      "type": "string",
      "pattern": "^[A-Za-z0-9][A-Za-z0-9._-]{1,127}$"
    },
    "name": {
      "description": "Display name",
      "type": "string",
      "minLength": 1,
      "maxLength": 100
    },
    "shortDescription": {
      "description": "One or two sentences, shown on the plugin card",
      "type": "string",
      "minLength": 1,
      "maxLength": 300
    },
    "description": {
      "description": "Full description (Markdown)",
      "type": "string",
      "minLength": 1,
      "maxLength": 20000
    },
    "provider": {
      "description": "Author or organization",
      "type": "string",
      "minLength": 1,
      "maxLength": 100
    },
    "license": {
      "description": "License of the plugin, preferably an SPDX identifier (e.g. MIT, Apache-2.0, AGPL-3.0-only)",
      "type": "string",
      "minLength": 1,
      "maxLength": 100
    },
    "projectUrl": {
      "description": "Homepage or source code repository",
      "type": "string",
      "pattern": "^https://[^\\s@/]+(/\\S*)?$"
    },
    "logo": {
      "description": "Logo (PNG, JPEG, GIF, WebP or SVG, max. 1 MB). Square images work best.",
      "type": "string",
      "pattern": "^https://[^\\s@/]+(/\\S*)?$"
    },
    "types": {
      "description": "Extension points implemented by the plugin",
      "type": "array",
      "minItems": 1,
      "uniqueItems": true,
      "items": {
        "enum": [
          "GameMetadataProvider",
          "DownloadProvider",
          "GameyfinTask"
        ]
      }
    },
    "tags": {
      "type": "array",
      "maxItems": 10,
      "items": {
        "type": "string",
        "pattern": "^[a-z0-9][a-z0-9-]{0,29}$"
      }
    },
    "maintainers": {
      "description": "GitHub usernames allowed to update this manifest. Not published in plugins.json.",
      "type": "array",
      "minItems": 1,
      "items": {
        "type": "string",
        "pattern": "^[A-Za-z0-9](?:[A-Za-z0-9]|-(?=[A-Za-z0-9])){0,38}$"
      }
    },
    "releases": {
      "type": "array",
      "minItems": 1,
      "items": {
        "$ref": "#/$defs/release"
      }
    }
  },
  "$defs": {
    "release": {
      "type": "object",
      "additionalProperties": false,
      "required": [
        "version",
        "date",
        "requires",
        "url",
        "sha512sum"
      ],
      "properties": {
        "version": {
          "description": "Semantic version. Must be identical to 'Plugin-Version' in the MANIFEST.MF of the plugin JAR.",
          "type": "string",
          "pattern": "^(0|[1-9]\\d*)\\.(0|[1-9]\\d*)\\.(0|[1-9]\\d*)(?:-[0-9A-Za-z.-]+)?(?:\\+[0-9A-Za-z.-]+)?$"
        },
        "date": {
          "description": "Release date (yyyy-MM-dd or ISO-8601 date-time)",
          "type": "string",
          "pattern": "^\\d{4}-\\d{2}-\\d{2}(?:T\\d{2}:\\d{2}(?::\\d{2}(?:\\.\\d+)?)?(?:Z|[+-]\\d{2}:\\d{2}))?$"
        },
        "requires": {
          "description": "Compatible Gameyfin versions, e.g. '>=2.5.1'. Must be identical to 'Plugin-Requires' in the MANIFEST.MF of the plugin JAR.",
          "type": "string",
          "minLength": 1
        },
        "url": {
          "description": "Download URL of the plugin JAR. Must never change its content (e.g. a GitHub release asset).",
          "type": "string",
          "pattern": "^https://[^\\s@/]+(/\\S*)?$"
        },
        "sha512sum": {
          "description": "SHA-512 checksum of the plugin JAR (128 lowercase hex characters)",
          "type": "string",
          "pattern": "^[0-9a-f]{128}$"
        },
        "changelog": {
          "description": "Changes in this release (Markdown)",
          "type": "string"
        }
      }
    }
  }
}
