{
  "$schema": "../schema/plugin-manifest.schema.json",
  "id": "io.github.shade1982.gameyfin.plugins.gogdb",
  "name": "GoGDB Metadata",
  "shortDescription": "Fetches game metadata from GoGDB.",
  "description": "Searches GoGDB for game metadata, including descriptions, developers, publishers, release dates, and supported platforms. Intended as a supplementary provider alongside a primary metadata source.",
  "provider": "Shade1982",
  "license": "GPL-2.0",
  "projectUrl": "https://github.com/Shade1982/gameyfin-gogdb-metadata-plugin",
  "logo": "https://raw.githubusercontent.com/Shade1982/gameyfin-gogdb-metadata-plugin/main/src/main/resources/logo.svg",
  "types": [
    "GameMetadataProvider"
  ],
  "tags": [
    "metadata",
    "gogdb"
  ],
  "maintainers": [
    "Shade1982"
  ],
  "releases": [
    {
      "version": "0.1.3",
      "date": "2026-10-20",
      "requires": ">=2.5.0",
      "url": "https://github.com/Shade1982/gameyfin-gogdb-metadata-plugin/releases/download/v0.1.3/gogdb-plugin-0.1.3.jar",
      "sha512sum": "81ec7925708811cfd73b3253cb3cfad7a1f9f249aa970f7546ebb4e2bac235b128fa34a0483460e8eea66f816d6f2a8684f802fd00026fa3e572113724be79c8"
    }
  ]
}
